<?xml version="1.0" encoding="UTF-8" standalone="yes"?>
<?xml-stylesheet type="text/xsl" href="frame.xsl"?>
<frame cBy="605" cDate="03/05/2004 04:05:16 PST Fri" name="Noise_makers" ID="1017" xsi:schemaLocation="../schema/frame.xsd" xmlns="http://framenet.icsi.berkeley.edu" xmlns:xsi="http://www.w3.org/2001/XMLSchema-instance">
    <definition>&lt;def-root&gt;The &lt;fen&gt;Noise_maker&lt;/fen&gt; is an artifact used to produce sound, especially for musical effect.

&lt;ex&gt;The &lt;fex name="Grnd"&gt;church&lt;/fex&gt; &lt;t&gt;&lt;fex name="nm"&gt;bells&lt;/fex&gt;&lt;/t&gt; rang&lt;/ex&gt;
&lt;ex&gt;The &lt;fex name="Grnd"&gt;car&lt;/fex&gt; &lt;t&gt;&lt;fex name="nm"&gt;alarm&lt;/fex&gt;&lt;/t&gt; went off again&lt;/ex&gt;
&lt;ex&gt;I have never played an &lt;fex name="tp"&gt;acoustic&lt;/fex&gt;  &lt;t&gt;&lt;fex name="nm"&gt;guitar&lt;/fex&gt;&lt;/t&gt;.&lt;/ex&gt;
&lt;ex&gt;Each artist personally owns a Steinway and has chosen to perform on the &lt;fex name="Creator"&gt;Steinway&lt;/fex&gt; &lt;t&gt;piano&lt;/t&gt; professionally&lt;/ex&gt;&lt;/def-root&gt;</definition>
    <FE bgColor="FF0000" fgColor="FFFFFF" coreType="Core" cBy="605" cDate="03/05/2004 04:05:16 PST Fri" abbrev="nm" name="Noise_maker" ID="6043">
        <definition>&lt;def-root&gt;This FE identifies the entity or substance that is designed to produce sound.&lt;/def-root&gt;</definition>
        <semType name="Artifact" ID="61"/>
    </FE>
    <FE bgColor="9400D3" fgColor="FFFFFF" coreType="Peripheral" cBy="605" cDate="03/05/2004 04:05:16 PST Fri" abbrev="s" name="Use" ID="6044">
        <definition>&lt;def-root&gt;The use for which an &lt;fen&gt;Noise_maker&lt;/fen&gt;  is intended.&lt;/def-root&gt;</definition>
    </FE>
    <FE bgColor="00BFFF" fgColor="FFFFFF" coreType="Peripheral" cBy="605" cDate="03/05/2004 04:05:17 PST Fri" abbrev="crt" name="Creator" ID="6045">
        <definition>&lt;def-root&gt;An individual or individuals that bring the &lt;fen&gt;Noise_maker&lt;/fen&gt; into existence.&lt;/def-root&gt;</definition>
    </FE>
    <FE bgColor="FFA500" fgColor="FFFFFF" coreType="Peripheral" cBy="605" cDate="03/05/2004 04:05:17 PST Fri" abbrev="toc" name="Time_of_creation" ID="6046">
        <definition>&lt;def-root&gt;The time at which a &lt;fen&gt;Noise_maker&lt;/fen&gt; comes into existence.&lt;/def-root&gt;</definition>
    </FE>
    <FE bgColor="008000" fgColor="FFFFFF" coreType="Peripheral" cBy="605" cDate="03/05/2004 04:05:17 PST Fri" abbrev="" name="Name" ID="6047">
        <definition>&lt;def-root&gt;The term used to refer to an &lt;fen&gt;Noise_maker&lt;/fen&gt;.&lt;/def-root&gt;</definition>
    </FE>
    <FE bgColor="00008B" fgColor="FFFFFF" coreType="Peripheral" cBy="605" cDate="03/05/2004 04:05:17 PST Fri" abbrev="tp" name="Type" ID="6048">
        <definition>&lt;def-root&gt;An indication of the subtype of &lt;fen&gt;Noise_maker&lt;/fen&gt;.&lt;/def-root&gt;</definition>
    </FE>
    <FE bgColor="A52A2A" fgColor="FFFFFF" coreType="Peripheral" cBy="605" cDate="03/05/2004 04:05:17 PST Fri" abbrev="mat" name="Material" ID="6049">
        <definition>&lt;def-root&gt;Any indication of what makes up the &lt;fen&gt;Noise_maker&lt;/fen&gt;, including components, etc.&lt;/def-root&gt;</definition>
    </FE>
    <FE bgColor="7CCD7C" fgColor="FFFFFF" coreType="Peripheral" cBy="605" cDate="03/05/2004 04:19:06 PST Fri" abbrev="Grnd" name="Ground" ID="6050">
        <definition>&lt;def-root&gt;The location with which the &lt;fen&gt;Noise_maker&lt;/fen&gt; is associated.&lt;/def-root&gt;</definition>
    </FE>
    <frameRelation type="Inherits from">
        <relatedFrame>Artifact</relatedFrame>
    </frameRelation>
    <frameRelation type="Is Inherited by"/>
    <frameRelation type="Perspective on"/>
    <frameRelation type="Is Perspectivized in"/>
    <frameRelation type="Uses"/>
    <frameRelation type="Is Used by"/>
    <frameRelation type="Subframe of"/>
    <frameRelation type="Has Subframe(s)"/>
    <frameRelation type="Precedes"/>
    <frameRelation type="Is Preceded by"/>
    <frameRelation type="Is Inchoative of"/>
    <frameRelation type="Is Causative of"/>
    <frameRelation type="See also"/>
    <lexUnit status="Created" POS="N" name="guitar.n" ID="10210" lemmaID="17047" cBy="605" cDate="03/05/2004 04:31:24 PST Fri">
        <definition>COD: a stringed musical instrument with a fretted fingerboard and six or twelve strings, played by plucking or strumming with the fingers or a plectrum</definition>
        <sentenceCount annotated="0" total="0"/>
        <lexeme order="1" headword="false" breakBefore="false" POS="N" name="guitar"/>
    </lexUnit>
    <lexUnit status="Created" POS="N" name="bell.n" ID="10211" lemmaID="3298" cBy="605" cDate="03/05/2004 04:32:09 PST Fri">
        <definition>COD: a hollow object, typically made of metal and in the shape of a deep inverted cup, that sounds a clear musical note when struck</definition>
        <sentenceCount annotated="0" total="0"/>
        <lexeme order="1" headword="false" breakBefore="false" POS="N" name="bell"/>
    </lexUnit>
    <lexUnit status="Created" POS="N" name="siren.n" ID="10212" lemmaID="36040" cBy="605" cDate="03/05/2004 04:32:49 PST Fri">
        <definition>COD: a device that makes a loud prolonged signal or warning sound</definition>
        <sentenceCount annotated="0" total="0"/>
        <lexeme order="1" headword="false" breakBefore="false" POS="N" name="siren"/>
    </lexUnit>
    <lexUnit status="Needs_SCs" POS="N" name="piano.n" ID="10213" lemmaID="28875" cBy="605" cDate="03/05/2004 04:33:21 PST Fri">
        <definition>COD: a large keyboard musical instrument with a wooden case enclosing a soundboard and metal strings, which are struck by hammers when the keys are depressed.</definition>
        <sentenceCount annotated="1" total="90"/>
        <lexeme order="1" headword="false" breakBefore="false" POS="N" name="piano"/>
    </lexUnit>
    <lexUnit status="Created" POS="N" name="rattle.n" ID="10214" lemmaID="31896" cBy="605" cDate="03/05/2004 04:33:48 PST Fri">
        <definition>COD: a thing that makes a rattling sound, in particular a baby's toy consisting of a container filled with small pellets</definition>
        <sentenceCount annotated="0" total="0"/>
        <lexeme order="1" headword="false" breakBefore="false" POS="N" name="rattle"/>
    </lexUnit>
    <lexUnit status="Created" POS="N" name="xylophone.n" ID="10215" lemmaID="44636" cBy="605" cDate="03/05/2004 04:34:28 PST Fri">
        <definition>COD: a musical instrument played by striking a row of wooden bars of graduated length with small beaters</definition>
        <sentenceCount annotated="0" total="0"/>
        <lexeme order="1" headword="false" breakBefore="false" POS="N" name="xylophone"/>
    </lexUnit>
    <lexUnit status="Created" POS="N" name="drum.n" ID="10216" lemmaID="11855" cBy="605" cDate="03/05/2004 04:35:00 PST Fri">
        <definition>COD: a percussion instrument sounded by being struck with sticks or the hands, typically cylindrical, barrel-shaped, or bowl-shaped with a taut membrane over one or both ends.</definition>
        <sentenceCount annotated="0" total="0"/>
        <lexeme order="1" headword="false" breakBefore="false" POS="N" name="drum"/>
    </lexUnit>
    <lexUnit status="Created" POS="N" name="cello.n" ID="10217" lemmaID="5868" cBy="605" cDate="03/05/2004 04:35:48 PST Fri">
        <definition>COD:  a bass instrument of the violin family, held upright on the floor between the legs of the seated player.</definition>
        <sentenceCount annotated="0" total="0"/>
        <lexeme order="1" headword="false" breakBefore="false" POS="N" name="cello"/>
    </lexUnit>
    <lexUnit status="Created" POS="N" name="saxophone.n" ID="10218" lemmaID="34273" cBy="605" cDate="03/05/2004 04:38:50 PST Fri">
        <definition>COD: a member of a family of metal wind instruments with a reed like a clarinet, used especially in jazz and dance music</definition>
        <sentenceCount annotated="0" total="0"/>
        <lexeme order="1" headword="false" breakBefore="false" POS="N" name="saxophone"/>
    </lexUnit>
    <lexUnit status="Created" POS="N" name="alarm.n" ID="11243" lemmaID="945" cBy="303" cDate="11/19/2004 04:52:12 PST Fri">
        <definition>COD: a warning sound or device.</definition>
        <sentenceCount annotated="0" total="0"/>
        <lexeme order="1" headword="false" breakBefore="false" POS="N" name="alarm"/>
    </lexUnit>
</frame>