<?xml version="1.0" encoding="UTF-8" standalone="yes"?>
<?xml-stylesheet type="text/xsl" href="frame.xsl"?>
<frame cBy="618" cDate="06/02/2005 05:21:14 PDT Thu" name="Infrastructure" ID="1481" xsi:schemaLocation="../schema/frame.xsd" xmlns="http://framenet.icsi.berkeley.edu" xmlns:xsi="http://www.w3.org/2001/XMLSchema-instance">
    <definition>&lt;def-root&gt;A group of entities exist (as an infrastructure) such that a particular type of &lt;fen&gt;Activity&lt;/fen&gt; is either enabled or facilitated.  The entities may or may not have been organized specifically for the &lt;fen&gt;Activity&lt;/fen&gt;.  The infrastructure is constituted by &lt;fen&gt;Resource&lt;/fen&gt;s that can be made use of by &lt;fen&gt;User&lt;/fen&gt;s, and the infrastructure may be specified for its &lt;fen&gt;Place&lt;/fen&gt; or &lt;fen&gt;Possessor&lt;/fen&gt;.

&lt;ex&gt;While the &lt;fex name="Possessor"&gt;US&lt;/fex&gt; &lt;fex name="Activity"&gt;transportation&lt;/fex&gt; &lt;t&gt;&lt;fex name="Infrastructure"&gt;infrastructure&lt;/fex&gt;&lt;/t&gt; continues to crumble, competitors in Brazil and Argentina are investing millions to improve their transportation&lt;/ex&gt;

&lt;ex&gt;The exacerbated sprawl like growth in the last decades has been a direct result of decisions taken in the creation, boost, and development of &lt;fex name="Resource"&gt;highway&lt;/fex&gt; &lt;t&gt;&lt;fex name="Infrastructure"&gt;infrastructure&lt;/fex&gt;&lt;/t&gt;.&lt;/ex&gt;

&lt;ex&gt;Mexico's Ministry of Tourism expects to see more than $1.78 billion invested to further develop &lt;fex name="Possessor"&gt;the country's&lt;/fex&gt; &lt;fex name="Activity"&gt;tourism&lt;/fex&gt; &lt;t&gt;&lt;fex name="Infrastructure"&gt;infrastructure&lt;/fex&gt;&lt;/t&gt;.&lt;/ex&gt;&lt;/def-root&gt;</definition>
    <FE bgColor="A52A2A" fgColor="FFFFFF" coreType="Core" cBy="618" cDate="06/02/2005 05:58:37 PDT Thu" abbrev="act" name="Activity" ID="8074">
        <definition>&lt;def-root&gt;The &lt;fen&gt;Activity&lt;/fen&gt; which is enabled or facilitated by the infrastructure.

&lt;ex&gt;At present, you'll find that Belize has a &lt;fex name="act"&gt;travel&lt;/fex&gt; &lt;t&gt;infrastructure&lt;/t&gt; that's improving but still far from polished.&lt;/ex&gt;
&lt;ex&gt;As a result , one of the central policy priorities of government has been to strengthen significantly the
&lt;fex name="act"&gt;academic&lt;/fex&gt; &lt;t&gt;infrastructure&lt;/t&gt;.&lt;/ex&gt;&lt;/def-root&gt;</definition>
    </FE>
    <FE bgColor="008000" fgColor="FFFFFF" coreType="Peripheral" cBy="618" cDate="06/02/2005 06:11:07 PDT Thu" abbrev="pla" name="Place" ID="8075">
        <definition>&lt;def-root&gt;The location of the infrastructure.

&lt;ex&gt;Much of the transportation &lt;t&gt;infrastructure&lt;/t&gt; &lt;fex name="Place"&gt;in the US&lt;/fex&gt; was developed when there was no need for private money.&lt;/ex&gt;&lt;/def-root&gt;</definition>
        <semType name="Locative_relation" ID="182"/>
    </FE>
    <FE bgColor="FF0000" fgColor="FFFFFF" coreType="Core" cBy="618" cDate="06/02/2005 06:12:54 PDT Thu" abbrev="pos" name="Possessor" ID="8076">
        <definition>&lt;def-root&gt;The organization, institution, or individual who owns the infrastructure.

&lt;ex&gt;Increase the value of  &lt;fex name="pos"&gt;your company's&lt;/fex&gt; technology &lt;t&gt;infrastructure&lt;/t&gt;&lt;/ex&gt;&lt;/def-root&gt;</definition>
    </FE>
    <FE bgColor="0000FF" fgColor="FFFFFF" coreType="Core" cBy="618" cDate="06/02/2005 06:16:45 PDT Thu" abbrev="res" name="Resource" ID="8077">
        <definition>&lt;def-root&gt;The infrastructure may be conceived of as consisting of Resources that can be made use of by Users in performing an Activity.

&lt;ex&gt;Members of the organization can use the &lt;fex name="res"&gt;service&lt;/fex&gt; &lt;t&gt;infrastructure&lt;/t&gt; to perform management tasks.&lt;/ex&gt;
&lt;ex&gt;It is critical to point out that, while our &lt;fex name="res"&gt;highway&lt;/fex&gt; &lt;t&gt;infrastructure&lt;/t&gt; continues to deteriorate, highway use is on the rise.&lt;/ex&gt;&lt;/def-root&gt;</definition>
    </FE>
    <FE bgColor="800080" fgColor="FFFFFF" coreType="Core" cBy="618" cDate="06/02/2005 06:27:16 PDT Thu" abbrev="user" name="User" ID="8078">
        <definition>&lt;def-root&gt;The people for whom the infrastructure is designed to be used by.  In the cases where the constituent denoting the user also evokes the &lt;fen&gt;Activity&lt;/fen&gt;, we annotate this on the second FE layer.

&lt;ex&gt; There are no specific barriers to investment in Bulgaria's &lt;fex name="user"&gt;tourist&lt;/fex&gt; &lt;t&gt;infrastructure&lt;/t&gt; or in the import of products to be used for tourist infrastructure development.&lt;/ex&gt;
&lt;ex&gt; There are no specific barriers to investment in Bulgaria's &lt;fex name="act"&gt;tourist&lt;/fex&gt; &lt;t&gt;infrastructure&lt;/t&gt; or in the import of products to be used for tourist infrastructure development.&lt;/ex&gt;
&lt;ex&gt;Our company makes constant use of the vast &lt;t&gt;infrastructure&lt;/t&gt; &lt;fex name="user"&gt;for businesses&lt;/fex&gt; offered by the government.&lt;/ex&gt;&lt;/def-root&gt;</definition>
    </FE>
    <FE bgColor="FF00FF" fgColor="FFFFFF" coreType="Peripheral" cBy="618" cDate="06/02/2005 06:34:25 PDT Thu" abbrev="des" name="Descriptor" ID="8079">
        <definition>&lt;def-root&gt;A characterization of the infrastructure.&lt;/def-root&gt;</definition>
    </FE>
    <FE bgColor="00008B" fgColor="FFFFFF" coreType="Core" cBy="664" cDate="12/07/2005 11:56:02 PST Wed" abbrev="inf" name="Infrastructure" ID="9589">
        <definition>&lt;def-root&gt;The collection of entities and/or institutions that help to promote an &lt;fen&gt;Activity&lt;/fen&gt; of a public character.&lt;/def-root&gt;</definition>
    </FE>
    <frameRelation type="Inherits from">
        <relatedFrame>Artifact</relatedFrame>
    </frameRelation>
    <frameRelation type="Is Inherited by"/>
    <frameRelation type="Perspective on"/>
    <frameRelation type="Is Perspectivized in"/>
    <frameRelation type="Uses"/>
    <frameRelation type="Is Used by">
        <relatedFrame>Institutions</relatedFrame>
    </frameRelation>
    <frameRelation type="Subframe of"/>
    <frameRelation type="Has Subframe(s)"/>
    <frameRelation type="Precedes"/>
    <frameRelation type="Is Preceded by"/>
    <frameRelation type="Is Inchoative of"/>
    <frameRelation type="Is Causative of"/>
    <frameRelation type="See also"/>
    <lexUnit status="Finished_Initial" POS="N" name="infrastructure.n" ID="12168" lemmaID="19903" cBy="618" cDate="06/02/2005 06:38:48 PDT Thu">
        <definition>FN: the basic facilities, installations, or other components needed for the operation of a system or organization</definition>
        <sentenceCount annotated="44" total="440"/>
        <lexeme order="1" headword="false" breakBefore="false" POS="N" name="infrastructure"/>
    </lexUnit>
    <lexUnit status="Created" POS="N" name="base.n" ID="12206" lemmaID="2969" cBy="618" cDate="06/13/2005 04:45:20 PDT Mon">
        <definition>FN: a system that allows for a particular activity to take place.</definition>
        <sentenceCount annotated="0" total="0"/>
        <lexeme order="1" headword="false" breakBefore="false" POS="N" name="base"/>
    </lexUnit>
</frame>