<?xml version="1.0" encoding="UTF-8" standalone="yes"?>
<?xml-stylesheet type="text/xsl" href="frame.xsl"?>
<frame cBy="618" cDate="07/18/2005 04:05:13 PDT Mon" name="Economy" ID="1572" xsi:schemaLocation="../schema/frame.xsd" xmlns="http://framenet.icsi.berkeley.edu" xmlns:xsi="http://www.w3.org/2001/XMLSchema-instance">
    <definition>&lt;def-root&gt;A &lt;fen&gt;Political_region&lt;/fen&gt;, often a nation,  has an economic system, the&lt;fen&gt;Economy&lt;/fen&gt;, defined by the level of production and consumption of goods and services.  The &lt;fen&gt;Market_type&lt;/fen&gt; or &lt;fen&gt;Domain&lt;/fen&gt; may be specified.

&lt;ex&gt;The &lt;fex name="pol"&gt;Canadian&lt;/fex&gt; &lt;t&gt;&lt;fex name="Economy"&gt;economy&lt;/fex&gt;&lt;/t&gt; will continue to expand in 2005.&lt;/ex&gt;
&lt;ex&gt;Medical industry is a new force in the &lt;fex name="dom"&gt;industrial&lt;/fex&gt; &lt;t&gt;&lt;fex name="Economy"&gt;economy&lt;/fex&gt;&lt;/t&gt; &lt;fex name="pol"&gt;of Lin'an&lt;/fex&gt;.&lt;/ex&gt;&lt;/def-root&gt;</definition>
    <FE bgColor="0000FF" fgColor="FFFFFF" coreType="Core" cBy="618" cDate="07/18/2005 04:15:48 PDT Mon" abbrev="pol" name="Political_region" ID="8602">
        <definition>&lt;def-root&gt;The &lt;fen&gt;Political_region&lt;/fen&gt; is the nation, state, or other political body within which an economic system exists.&lt;/def-root&gt;</definition>
    </FE>
    <FE bgColor="800080" fgColor="FFFFFF" coreType="Core" cBy="618" cDate="07/18/2005 04:16:41 PDT Mon" abbrev="eco" name="Economy" ID="8603">
        <definition>&lt;def-root&gt;The &lt;fen&gt;Economy&lt;/fen&gt; is the state of the &lt;fen&gt;Political_region&lt;/fen&gt; as defined by the production, consumption, etc. of goods and services.&lt;/def-root&gt;</definition>
    </FE>
    <FE bgColor="FF0000" fgColor="FFFFFF" coreType="Peripheral" cBy="618" cDate="07/18/2005 04:23:02 PDT Mon" abbrev="dom" name="Domain" ID="8604">
        <definition>&lt;def-root&gt;The &lt;fen&gt;Domain&lt;/fen&gt; of the state for which the &lt;fen&gt;Economy&lt;/fen&gt; is being considered.

&lt;ex&gt;In this way the &lt;fex name="dom"&gt;agrarian&lt;/fex&gt; &lt;t&gt;economy&lt;/t&gt; of the mainland might have proceeded towards a further specialization in agricultural products and a more effective production of food.&lt;/ex&gt;&lt;/def-root&gt;</definition>
    </FE>
    <FE bgColor="A52A2A" fgColor="FFFFFF" coreType="Peripheral" cBy="618" cDate="07/18/2005 04:25:05 PDT Mon" abbrev="mar" name="Market_type" ID="8605">
        <definition>&lt;def-root&gt;The type of economic market in which the &lt;fen&gt;Economy&lt;/fen&gt; exists.

&lt;ex&gt;For much of its post-1947 history, India ran a &lt;fex name="mar"&gt;socialist&lt;/fex&gt; &lt;t&gt;economy&lt;/t&gt;.&lt;/ex&gt;
&lt;ex&gt;China's &lt;fex name="mar"&gt;free-market&lt;/fex&gt; &lt;t&gt;economy&lt;/t&gt; is generating unprecedented but not unlimited press freedoms, and there's momentum.&lt;/ex&gt;&lt;/def-root&gt;</definition>
    </FE>
    <FE bgColor="2E8B57" fgColor="FFFFFF" coreType="Peripheral" cBy="618" cDate="07/18/2005 04:28:24 PDT Mon" abbrev="des" name="Descriptor" ID="8606">
        <definition>&lt;def-root&gt;A further depction of the &lt;fen&gt;Economy&lt;/fen&gt;.

&lt;ex&gt;Hertfordshire enjoys a &lt;fex name="des"&gt;buoyant&lt;/fex&gt; &lt;t&gt;economy&lt;/t&gt;.&lt;/ex&gt;&lt;/def-root&gt;</definition>
    </FE>
    <frameRelation type="Inherits from"/>
    <frameRelation type="Is Inherited by"/>
    <frameRelation type="Perspective on"/>
    <frameRelation type="Is Perspectivized in"/>
    <frameRelation type="Uses">
        <relatedFrame>Political_locales</relatedFrame>
    </frameRelation>
    <frameRelation type="Is Used by"/>
    <frameRelation type="Subframe of"/>
    <frameRelation type="Has Subframe(s)"/>
    <frameRelation type="Precedes"/>
    <frameRelation type="Is Preceded by"/>
    <frameRelation type="Is Inchoative of"/>
    <frameRelation type="Is Causative of"/>
    <frameRelation type="See also"/>
    <lexUnit status="Finished_Initial" POS="N" name="economy.n" ID="12489" lemmaID="12193" cBy="618" cDate="07/18/2005 04:10:36 PDT Mon">
        <definition>COD: the state of a country or region in terms of the production and consumption of goods and services and the supply of money.</definition>
        <sentenceCount annotated="20" total="206"/>
        <lexeme order="1" headword="false" breakBefore="false" POS="N" name="economy"/>
    </lexUnit>
    <lexUnit status="New" POS="A" name="economic.a" ID="12490" lemmaID="12187" cBy="618" cDate="07/18/2005 04:15:20 PDT Mon">
        <definition>COD: of or relating to economics or the economy.</definition>
        <sentenceCount annotated="0" total="141"/>
        <lexeme order="1" headword="false" breakBefore="false" POS="A" name="economic"/>
    </lexUnit>
</frame>